{
  "$schema": "http://json-schema.org/draft-07/schema#",
  "$comment": "GENERATED by gui/schema-gen/derive_nf_config_schemas.py from config/mfaf.json + its source (ADR-0425). Do not edit; regenerate.",
  "title": "mfaf",
  "type": "object",
  "additionalProperties": false,
  "properties": {
    "port": {
      "type": "integer",
      "x-env-override": "MFAF_PORT",
      "x-cpp-type": "unsigned short"
    },
    "advertised_ipv4": {
      "type": "string",
      "x-env-override": "MFAF_ADVERTISED_IPV4",
      "x-cpp-type": "std::string"
    },
    "sbi_bind_address": {
      "type": "string",
      "x-env-override": "MFAF_SBI_BIND_ADDRESS",
      "x-cpp-type": "std::string"
    },
    "metrics_bind_address": {
      "type": "string",
      "x-env-override": "MFAF_METRICS_BIND_ADDRESS",
      "x-cpp-type": "std::string"
    },
    "nrf_base_url": {
      "type": "string",
      "x-env-override": "MFAF_NRF_BASE_URL",
      "x-cpp-type": "std::string"
    },
    "redis_url": {
      "type": "string",
      "x-env-override": "MFAF_REDIS_URL",
      "x-cpp-type": "std::string"
    },
    "nrf_heartbeat_seconds": {
      "type": "integer",
      "x-env-override": "MFAF_NRF_HEARTBEAT_SECONDS",
      "x-cpp-type": "int"
    },
    "event_bus_brokers": {
      "type": "string",
      "x-env-override": "MFAF_EVENT_BUS_BROKERS",
      "x-cpp-type": "std::string"
    },
    "event_bus_topic": {
      "type": "string",
      "x-env-override": "MFAF_EVENT_BUS_TOPIC",
      "x-cpp-type": "std::string"
    },
    "event_bus_group_id": {
      "type": "string",
      "x-env-override": "MFAF_EVENT_BUS_GROUP_ID",
      "x-cpp-type": "std::string"
    },
    "event_bus_flush_timeout_ms": {
      "type": "integer",
      "x-env-override": "MFAF_EVENT_BUS_FLUSH_TIMEOUT_MS",
      "x-cpp-type": "int"
    },
    "event_bus_poll_timeout_ms": {
      "type": "integer",
      "x-env-override": "MFAF_EVENT_BUS_POLL_TIMEOUT_MS",
      "x-cpp-type": "int"
    },
    "fetch_buffer_ttl_seconds": {
      "type": "integer",
      "x-env-override": "MFAF_FETCH_BUFFER_TTL_SECONDS",
      "x-cpp-type": "int"
    },
    "oauth2_required": {
      "type": "boolean",
      "x-env-override": "MFAF_OAUTH2_REQUIRED",
      "x-cpp-type": "bool"
    }
  },
  "required": [
    "advertised_ipv4",
    "event_bus_brokers",
    "event_bus_flush_timeout_ms",
    "event_bus_group_id",
    "event_bus_poll_timeout_ms",
    "event_bus_topic",
    "fetch_buffer_ttl_seconds",
    "metrics_bind_address",
    "nrf_base_url",
    "nrf_heartbeat_seconds",
    "port",
    "redis_url",
    "sbi_bind_address"
  ],
  "x-config-file": "config/mfaf.json",
  "x-source": [
    "nfs/mfaf"
  ],
  "x-apply": "restart",
  "x-review": []
}
